,book_id,goodreads_book_id,title,weighted_rating
1568,1569,143534,The Gift of the Magi,4.053641322809819
1763,1764,2179276,"The Time Paradox (Artemis Fowl, #6)",4.052746088949696
1628,1629,13662,"The Tombs of Atuan (Earthsea Cycle, #2)",4.052635396586473
1325,1326,22551730,Dead Wake: The Last Crossing of the Lusitania,4.0526316122804795
2115,2116,22055262,"A Darker Shade of Magic (Shades of Magic, #1)",4.052627405561039
1685,1686,189802,Belgarath the Sorcerer,4.052266176722194
787,788,23955,Trainspotting,4.052203696886805
2281,2282,3393124,"Max (Maximum Ride, #5)",4.051654294106363
1599,1600,220970,"Tripwire  (Jack Reacher, #3)",4.051224983483081
2549,2550,30242,"Burnt Offerings (Anita Blake, Vampire Hunter, #7)",4.050907383334111
2272,2273,29981261,The Butterfly Garden (The Collector #1),4.050802113130408
2029,2030,64854,"M is for Malice (Kinsey Millhone, #13)",4.050614021912606
1714,1715,943402,Let the Right One In,4.050528503471398
2445,2446,356321,The Story of Babar,4.0501122491629875
2802,2803,8788554,"First Grave on the Right (Charley Davidson, #1)",4.050032802796317
1825,1826,98427,The General's Daughter,4.049913982882827
1757,1758,6259,Birdsong,4.049819607381253
2686,2687,6431790,"Fang (Maximum Ride, #6)",4.049541592574107
1867,1868,14064,I Am Legend,4.048904077183256
2815,2816,9284655,"Tiger's Curse (The Tiger Saga, #1)",4.048663097467743
2003,2004,5306,Travels with Charley: In Search of America,4.048592729613574
1047,1048,108229,The Perfect Storm: A True Story of Men Against the Sea,4.048440228450122
2379,2380,72159,Cat on a Hot Tin Roof,4.047908675405974
1854,1855,773038,The Seven Spiritual Laws of Success: A Practical Guide to the Fulfillment of Your Dreams,4.047077724611513
3837,3838,2679633,"Pleasure Unbound (Demonica, #1)",4.0468591936071885
3062,3063,210329,"The Dark Is Rising (The Dark is Rising, #2)",4.046497123860314
2740,2741,6690,Danny the Champion of the World,4.0464666644875535
2684,2685,3047849,"Killer (Pretty Little Liars, #6)",4.04642799491435
2475,2476,3392089,"The Winter Sea (Slains, #1)",4.046377534074349
2758,2759,8962,"A Living Nightmare (Cirque Du Freak, #1)",4.046054594932272
2032,2033,3554772,عزازيل,4.045502979029877
2873,2874,114144,Montana Sky,4.045151636463629
2672,2673,5720,"Rainbow Six (Jack Ryan Universe, #10)",4.044580111113081
3294,3295,28250,"The Novice (Black Magician Trilogy, #2)",4.043483427767355
3234,3235,7108725,Start with Why: How Great Leaders Inspire Everyone to Take Action,4.043461352903089
3345,3346,383206,Wives and Daughters,4.0430272297473895
2866,2867,1319,The War of Art: Break Through the Blocks & Win Your Inner Creative Battles,4.042703892159568
4023,4024,11366397,"The Program (The Program, #1)",4.042237973786832
3251,3252,24580,The Adventures of Tom Sawyer & Adventures of Huckleberry Finn,4.042081829779988
3365,3366,32501,"Echo Park (Harry Bosch, #12; Harry Bosch Universe, #14)",4.041993532022686
5193,5194,199786,"Ninth Key (The Mediator, #2)",4.041914574920464
2769,2770,4979,A Man Without a Country,4.04187989102118
3540,3541,218427,"Gateway (Heechee Saga, #1)",4.041783650839391
4307,4308,59821,"Red Lily (In the Garden, #3)",4.041511884511126
3354,3355,8437667,Live Wire (Myron Bolitar #10),4.041311915937566
3458,3459,49540,Les Liaisons dangereuses,4.0410683332257715
3468,3469,38169,"Alas, Babylon",4.0410438057083455
3027,3028,92163,Sarum: The Novel of England,4.040988759805855
2648,2649,112803,The Story of My Experiments With Truth,4.0409211311103235
2790,2791,15842230,"The Forgotten (John Puller, #2)",4.040788492837289
4444,4445,24779,The Castle of Llyr (The Chronicles of Prydain #3),4.040471005866552
3915,3916,12083,Long Day's Journey Into Night,4.0403428060594795
3998,3999,8306745,"A World Without Heroes (Beyonders, #1)",4.040309045761713
3362,3363,7769,Dr. Seuss's ABC: An Amazing Alphabet Book! (Bright and Early Board Books),4.040281982132315
3834,3835,26023,"Bright Lights, Big Ass: A Self-Indulgent, Surly, Ex-Sorority Girl's Guide to Why It Often Sucks in the City, or Who Are These Idiots and Why Do They All Live Next Door to Me?",4.040017383045428
5315,5316,125926,"Dime Store Magic (Women of the Otherworld, #3)",4.03987002510948
4969,4970,8517008,"A Red Herring Without Mustard (Flavia de Luce, #3)",4.039681535659563
4566,4567,42369,The Hundred Dresses,4.039666149318588
4145,4146,481446,Nefertiti,4.038891925544027
5061,5062,469901,Mr. Perfect,4.03875233781326
5804,5805,58890,"Tris's Book (Circle of Magic, #2)",4.038586747407837
4206,4207,11198312,"The Medusa Plot (39 Clues: Cahills vs. Vespers, #1)",4.03857160666674
5276,5277,98405,"Born in Shame (Born In Trilogy, #3)",4.038508823701801
6742,6743,1316617,"Succubus on Top (Georgina Kincaid, #2)",4.0382951543323795
5231,5232,18884,Polgara the Sorceress (Malloreon),4.037365448455896
3644,3645,3272165,Bad Science,4.0372835783225955
7163,7164,8356487,"Heartless (Parasol Protectorate, #4)",4.037267154978267
4621,4622,17689,Franz Kafka's The Castle (Dramatization),4.0370043977896115
3788,3789,1168341,"Physics of the Impossible: A Scientific Exploration into the World of Phasers, Force Fields, Teleportation, and Time Travel",4.0369511870457195
6524,6525,13560262,"Avoiding Responsibility (Avoiding, #2)",4.036777445327065
4713,4714,27406704,Britt-Marie Was Here,4.036555148347613
5055,5056,18005,How I Became a Pirate,4.036411845151548
4677,4678,21362,"Seize the Night (Moonlight Bay, #2)",4.036271274243797
43,44,15931,"The Notebook (The Notebook, #1)",4.058861878343989
63,64,10917,My Sister's Keeper,4.058618157484821
64,65,4981,Slaughterhouse-Five,4.058590459907208
75,76,14935,Sense and Sensibility,4.0583909228287105
89,90,231804,The Outsiders,4.058202569064532
118,119,38447,The Handmaid's Tale,4.058055815924787
94,95,5297,The Picture of Dorian Gray,4.057998953973488
113,114,6900,Tuesdays with Morrie,4.057882924697948
228,229,24213,Alice's Adventures in Wonderland & Through the Looking-Glass,4.056622311370142
398,399,3950967,The Tales of Beedle the Bard,4.056003188683561
369,370,7090447,"The Red Pyramid (Kane Chronicles, #1)",4.055184110434678
469,470,17851885,I Am Malala: The Story of the Girl Who Stood Up for Education and Was Shot by the Taliban,4.054808374247297
442,443,51738,Just Listen,4.054524030888506
412,413,7190,The Three Musketeers,4.0543492994277575
474,475,8492825,"Where She Went (If I Stay, #2)",4.054293055185222
479,480,18122,"The Amber Spyglass (His Dark Materials, #3)",4.054270972806547
529,530,12957,Much Ado About Nothing,4.053784779302388
686,687,1067,1776,4.051924790938834
1275,1276,7488244,"Unearthly (Unearthly, #1)",4.0499008790478745
996,997,136116,The Scarlet Pimpernel,4.049307059830816
896,897,112537,"Rendezvous with Rama (Rama, #1)",4.049300885780774
1067,1068,29209,The Color of Water: A Black Man's Tribute to His White Mother,4.048017241570033
1166,1167,6656,The Divine Comedy,4.047165116418553
1778,1779,11918,"Bitten (Women of the Otherworld, #1)",4.046869955504142
1314,1315,25179,Blankets,4.0466500930634925
1492,1493,130580,"Old Yeller (Old Yeller, #1)",4.0465563199114
1583,1584,18545,Rosencrantz and Guildenstern Are Dead,4.046139140345111
1688,1689,1158967,"Garden Spells (Waverley Family, #1)",4.045872057257883
1740,1741,131359,"Death on the Nile (Hercule Poirot, #17)",4.045796580904598
1485,1486,83346,"Through the Looking-Glass, and What Alice Found There",4.045476265808053
1845,1846,17876893,"Captivated by You (Crossfire, #4)",4.044516616136935
2314,2315,24335,The Trumpet of the Swan,4.043550290874486
1461,1462,11529868,The Orphan Master's Son,4.043455492055655
1756,1757,27252,Pope Joan,4.0431407517248985
1769,1770,15729539,NOS4A2,4.042856205455833
2198,2199,89723,The Lottery and Other Stories,4.042469653909279
2849,2850,46202,"Magic Study (Study, #2)",4.0423751677199
1880,1881,100365,The Mote in God's Eye,4.042348966977694
2401,2402,1537534,"Unbelievable (Pretty Little Liars, #4)",4.041982567131965
1909,1910,93101,The Arabian Nights,4.041965031012439
3175,3176,261122,"The Dead Girls' Dance (The Morganville Vampires, #2)",4.041855594384481
2940,2941,16429619,"The Kiss of Deception (The Remnant Chronicles, #1)",4.041814854694691
2022,2023,186190,"Forrest Gump (Forrest Gump, #1)",4.04169618876608
2212,2213,32424,Lightning,4.041351210370618
2321,2322,9500416,Dreams of Joy (Shanghai Girls #2),4.041190302767673
2399,2400,92147,"Map of Bones (Sigma Force, #2)",4.040886036251534
2452,2453,149302,"Silverthorn (The Riftwar Saga, #3)",4.04068071592408
2772,2773,552894,"7th Heaven (Women's Murder Club, #7)",4.039500351173764
3275,3276,103983,"Skeleton Key (Alex Rider, #3)",4.039054107480197
3557,3558,7600924,Forbidden,4.039044057959716
2525,2526,22369,"All-Star Superman, Vol. 1",4.038245207376837
4029,4030,84132,"The Dream Hunter (Dark-Hunter #10, Dream-Hunter #1)",4.038178052771507
3358,3359,78876,"Maskerade (Discworld, #18; Witches #5)",4.037864445841139
5258,5259,18584855,Heartless,4.037561472208207
1223,1224,771,"The Elegant Universe: Superstrings, Hidden Dimensions, and the Quest for the Ultimate Theory",4.037260241914041
5171,5172,17316075,"Second Chance Boyfriend (One Week Girlfriend, #2)",4.036231849507818
4647,4648,11947156,"Prince of Wolves (The Grey Wolves, #1)",4.036156781215578
4230,4231,31374,"A Great Deliverance (Inspector Lynley, #1)",4.035133872830784
3366,3367,113138,The Winner,4.035071529479509
3734,3735,11580,Creepshow,4.034962313836485
3134,3135,17262366,"One Summer: America, 1927",4.034727937190681
3864,3865,12099007,"The Last Boyfriend (Inn BoonsBoro, #2)",4.034530040725584
4255,4256,556136,The Wednesday Wars,4.034522612374356
3412,3413,36071,First Things First,4.034504554040673
5294,5295,30226,"A Stroke of Midnight (Merry Gentry, #4)",4.034488598944481
6066,6067,73080,"Nobody's Baby But Mine (Chicago Stars, #3)",4.034319856803889
4295,4296,10444,"Ballet Shoes (Shoes, #1)",4.034180522109508
3841,3842,6424184,"Thirst No. 2: Phantom, Evil Thirst, and Creatures of Forever (Thirst, #2)",4.034089717280537
6126,6127,17825503,Leo,4.033383716563109
4301,4302,2202049,"Such a Pretty Fat: One Narcissist's Quest to Discover If Her Life Makes Her Ass Look Big, or Why Pie Is Not the Answer",4.033289543872102
3944,3945,226791,Total Control,4.033176476921053
3527,3528,24911006,Missoula: Rape and the Justice System in a College Town,4.033077273788951
5856,5857,8130839,Bloodrose (Nightshade #3; Nightshade World #6),4.032840509010759
7060,7061,17831617,"Beautiful Bombshell (Beautiful Bastard, #2.5)",4.032768544115519
3793,3794,16255,"Tales of the City (Tales of the City, #1)",4.032714471860603
4117,4118,77160,"Across the Nightingale Floor (Tales of the Otori, #1)",4.032672402670242
6367,6368,58894,"Daja's Book (Circle of Magic, #3)",4.032110276975177
4776,4777,426025,A Rose for Emily and Other Stories,4.032068236487798
5402,5403,2051840,"The Coffin Club (Vampire Kisses, #5)",4.031828890308091
4329,4330,22632,The Trial and Death of Socrates,4.031548388384185
180,181,168642,In Cold Blood,4.047489065373659
246,247,36072,The 7 Habits of Highly Effective People: Powerful Lessons in Personal Change,4.046988516491467
288,289,76620,"Watership Down (Watership Down, #1)",4.046774607878653
272,273,1103,Snow Flower and the Secret Fan,4.0466468135699145
315,316,9791,A Walk in the Woods,4.046272590315002
335,336,13137,"1st to Die (Women's Murder Club, #1)",4.046035802768682
365,366,2203,John Adams,4.045731229387322
437,438,6469165,What Alice Forgot,4.04458725245706
623,624,140075,"All Together Dead (Sookie Stackhouse, #7)",4.044498484863567
695,696,43814,"The Vampire Lestat (The Vampire Chronicles, #2)",4.043774113370206
999,1000,10194157,"Shadow and Bone (Shadow and Bone, #1)",4.043532292712326
757,758,32145,Stiff: The Curious Lives of Human Cadavers,4.042959481408906
927,928,17675462,"The Raven Boys (The Raven Cycle, #1)",4.042921293373927
1142,1143,16102004,"Beautiful Bastard (Beautiful Bastard, #1)",4.04238520819358
753,754,6366437,Half Broke Horses,4.042323308479915
981,982,40024,"The Alienist (Dr. Laszlo Kreizler, #1)",4.0414385198520355
1119,1120,21348,Aesop's Fables,4.04077702882454
1252,1253,152380,"Mary Poppins (Mary Poppins, #1)",4.040261807315511
1324,1325,1914973,"The Likeness (Dublin Murder Squad, #2)",4.0391982923196865
1404,1405,6080337,"The Year of the Flood  (MaddAddam, #2)",4.038730973516058
1112,1113,51893,Thus Spoke Zarathustra,4.0383096102002485
1719,1720,7664334,Amy & Roger's Epic Detour,4.03829757198725
1573,1574,18423,The Left Hand of Darkness,4.037820560314775
1726,1727,357,"The Long Dark Tea-Time of the Soul (Dirk Gently, #2)",4.03742503497386
2207,2208,16001893,"Down to You (The Bad Boys, #1)",4.0374164301817075
1459,1460,24,In a Sunburned Country,4.0373324278181695
1886,1887,15638,Cyrano de Bergerac,4.036650080191388
2288,2289,41424,Beauty: A Retelling of the Story of Beauty and the Beast,4.036633319463442
1751,1752,77262,Animal Dreams,4.035984087309891
3230,3231,8379374,"Backstage Pass (Sinners on Tour, #1)",4.03579451682245
1906,1907,93007,The Merry Adventures of Robin Hood,4.035558213459081
2470,2471,28876,"His Majesty's Dragon (Temeraire, #1)",4.035454785623378
2350,2351,232123,"All That Remains (Kay Scarpetta, #3)",4.035073335849586
2169,2170,16790,Smoke and Mirrors: Short Fiction and Illusions,4.035047296415662
3106,3107,16062211,"The Proposition (The Proposition, #1)",4.034382095575235
2636,2637,89724,We Have Always Lived in the Castle,4.03438137204957
2295,2296,232145,"Unnatural Exposure (Kay Scarpetta, #8)",4.034364229019966
2023,2024,11991,The Fall,4.03430064184433
2623,2624,30013,Prelude to Foundation,4.033553424131062
3233,3234,8252,"Farmer Boy (Little House, #3)",4.033424317223465
2721,2722,1325218,"Scary Stories to Tell in the Dark (Scary Stories, #1)",4.033152632244793
2798,2799,13326831,"The Testing (The Testing, #1)",4.032943238762174
2516,2517,19494,The Spy Who Came In from the Cold,4.032773288490526
2356,2357,13839,The Botany of Desire: A Plant's-Eye View of the World,4.03266790106331
2112,2113,23153154,"Memory Man (Amos Decker, #1)",4.032569631125434
2573,2574,24244,"The Black Ice (Harry Bosch, #2; Harry Bosch Universe, #2)",4.0325326051188615
3903,3904,77391,"Anne of Ingleside (Anne of Green Gables, #6)",4.032500267325876
2835,2836,71865,"Tomorrow, When the War Began (Tomorrow, #1)",4.03245777493431
2247,2248,13538641,Killing Kennedy: The End of Camelot,4.0322415559876745
3371,3372,23009402,Saint Anything,4.032024414180729
2850,2851,667985,"Chobits, Vol. 1",4.03171173594373
4925,4926,114162,"Secrets of a Summer Night (Wallflowers, #1)",4.031332681828669
2909,2910,138269,Catch Me If You Can: The True Story of a Real Fake,4.030989534532503
3483,3484,5206937,A Modest Proposal,4.03078621404622
3937,3938,286507,"Demon Lord of Karanda (The Malloreon, #3)",4.030464459627029
4202,4203,11300302,"Alice in Zombieland (White Rabbit Chronicles, #1)",4.030433848246845
4655,4656,30240,"A Caress of Twilight (Merry Gentry, #2)",4.0302207214264065
3207,3208,239186,"Isaac's Storm: A Man, a Time, and the Deadliest Hurricane in History",4.030109865202899
3239,3240,4035,The Burden of Proof,4.029875577275486
5277,5278,7797874,"Return to Paradise (Leaving Paradise, #2)",4.029851523461856
3446,3447,18003300,Love & Misadventure,4.0297462167809766
3068,3069,38315,Fooled by Randomness: The Hidden Role of Chance in Life and in the Markets,4.029702318917509
6302,6303,18105011,"Sweet Home (Sweet Home, #1)",4.029695799341544
3011,3012,23481669,Maude,4.029555434957501
3545,3546,53645,Tender at the Bone: Growing Up at the Table,4.0293052820137705
3572,3573,22323,"Burning Chrome (Sprawl, #0)",4.029152144214616
3800,3801,9436746,"10th Anniversary (Women's Murder Club, #10)",4.029019378737749
3151,3152,2054761,The Snowball: Warren Buffett and the Business of Life,4.02899977576953
4041,4042,91249,"Ramona Forever (Ramona, #7)",4.028858429583721
5091,5092,30243,"Seduced by Moonlight (Merry Gentry, #3)",4.028726360080769
4949,4950,11178225,Out of the Easy,4.028511673422778
4600,4601,25690958,"Year of Yes: How to Dance It Out, Stand In the Sun and Be Your Own Person",4.02846729826597
3893,3894,9282,The Smoke Jumper,4.028399237573014
3736,3737,29925,"Gods and Generals (The Civil War Trilogy, #1)",4.028328423747336
3856,3857,99894,The Boys from Brazil,4.028297267383351
3004,3005,15791154,"The Hit (Will Robie, #2)",4.028144855613298
5222,5223,12925063,"Inescapable (The Premonition, #1)",4.028087088503245
5571,5572,674220,"Again the Magic (Wallflowers, #0)",4.028076163753021
3008,3009,81922,Rich Dad's Cashflow Quadrant: Rich Dad's Guide to Financial Freedom,4.028042370702849
3719,3720,110331,The Federalist Papers,4.027918209318066
3846,3847,10059498,The Midwife's Confession,4.027740829923964
4435,4436,9893331,"Twisted (Pretty Little Liars, #9)",4.027725142887031
4172,4173,91714,Civil War: A Marvel Comics Event,4.027527172752825
4577,4578,7983,"Salamandastron (Redwall, #5)",4.027463076985639
4152,4153,111222,The Life of Elizabeth I,4.027415269027655
4077,4078,32628,The Great and Secret Show (Book of the Art #1),4.02726295593872
3910,3911,531989,Drown,4.027246075983397
5192,5193,9578590,"Lost in Time (Blue Bloods, #6)",4.027173669314706
4924,4925,2855034,Nation,4.026813651536513
7785,7786,285212,"On the Prowl (Alpha & Omega, #0.5)",4.026430566862802
5540,5541,303472,"Among the Impostors (Shadow Children, #2)",4.026360053302014
41,42,1934,"Little Women (Little Women, #1)",4.039374260342344
116,117,18131,"A Wrinkle in Time (A Wrinkle in Time Quintet, #1)",4.038744442971451
93,94,320,One Hundred Years of Solitude,4.03843690393584
185,186,37470,"The Other Boleyn Girl (The Plantagenet and Tudor Novels, #9)",4.0380114428002996
207,208,6493208,The Immortal Life of Henrietta Lacks,4.037992321122126
320,321,10365,Where the Red Fern Grows,4.0372390105763305
384,385,8520610,Quiet: The Power of Introverts in a World That Can't Stop Talking,4.036417813120128
534,535,8490112,"Daughter of Smoke & Bone (Daughter of Smoke & Bone, #1)",4.036354931794102
491,492,7967,"Speaker for the Dead (Ender's Saga, #2)",4.035686704506788
476,477,78129,"Killing Floor (Jack Reacher, #1)",4.03565589985472
533,534,1044355,When You Are Engulfed in Flames,4.035351048949891
664,665,6690798,"The Passage (The Passage, #1)",4.034600901801234
691,692,1472878,"Firefly Lane (Firefly Lane, #1)",4.034411263859728
890,891,91477,"Fool Moon (The Dresden Files, #2)",4.033964465223937
880,881,63697,The Man Who Mistook His Wife for a Hat and Other Clinical Tales,4.033527238228761
977,978,11559200,"Shadow of Night (All Souls Trilogy, #2)",4.033282961530226
1171,1172,114954,"The Opal Deception  (Artemis Fowl, #4)",4.033151431376746
1136,1137,227865,"The Eternity Code (Artemis Fowl, #3)",4.033080275108679
1272,1273,30264,"Dead Witch Walking (The Hollows, #1)",4.032892933973371
1414,1415,10127019,The Lean Startup: How Today's Entrepreneurs Use Continuous Innovation to Create Radically Successful Businesses,4.032555174777434
992,993,12875258,Tell the Wolves I'm Home,4.032506211036421
931,932,76865,Good to Great: Why Some Companies Make the Leap... and Others Don't,4.032484736339934
1159,1160,2052,"The Big Sleep (Philip Marlowe, #1)",4.032428680153724
1538,1539,30555488,The Underground Railroad,4.031418412686747
1030,1031,4631,A Moveable Feast,4.031224462552456
1766,1767,6604794,The Sky Is Everywhere,4.03037376057406
2182,2183,8204005,"Love Unscripted (Love, #1)",4.030053430583276
1577,1578,32439,Intensity,4.029902883838799
1298,1299,9566,Still Life with Woodpecker,4.029739687656736
1957,1958,7933617,"Destined (House of Night, #9)",4.029731125596174
1762,1763,33668,"4th of July (Women's Murder Club, #4)",4.029584030999121
2419,2420,3992598,The Demigod Files (Percy Jackson and the Olympians),4.029557514285715
2181,2182,3099787,"Night World, No. 1 (Night World, #1-3)",4.029488625483767
1619,1620,14817,A Scanner Darkly,4.029359137688823
2048,2049,78039,"Ramona the Pest (Ramona, #2)",4.02910224054634
2548,2549,30246,"Blue Moon (Anita Blake, Vampire Hunter, #8)",4.029091539784932
2261,2262,153008,"Kushiel's Dart (Phèdre's Trilogy, #1)",4.029076791878623
2683,2684,187811,"Shadowland (The Mediator, #1)",4.029003054911288
2073,2074,6539,"The Body Farm (Kay Scarpetta, #5)",4.028932298801032
1962,1963,31259,"The Bourne Ultimatum (Jason Bourne, #3)",4.028380340664609
3137,3138,65840,"Anne of Windy Poplars (Anne of Green Gables, #4)",4.0283761191716625
1881,1882,9572203,"The Snowman (Harry Hole, #7)",4.02835513514635
2065,2066,762806,"Gorky Park (Arkady Renko, #1)",4.028237663328554
2001,2002,18386,The Death of Ivan Ilych,4.028152293286428
1698,1699,21104828,The Lake House,4.028150713674107
2054,2055,43931,The Woods,4.028130668731777
2705,2706,73070,"It Had to Be You (Chicago Stars, #1)",4.028082389583783
3144,3145,17448960,"Falling into You (Falling, #1)",4.027579974076691
3115,3116,10345927,"A Million Suns (Across the Universe, #2)",4.02745806305713
1853,1854,10872085,"Only Time Will Tell (The Clifton Chronicles, #1)",4.027169775041104
2374,2375,18989,"Tinker, Tailor, Soldier, Spy",4.027104410219826
3043,3044,1375896,"Queste (Septimus Heap, #4)",4.027039846080934
3046,3047,105551,Fox in Socks,4.026999190574487
2732,2733,1099301,"The Name of This Book Is Secret (Secret, #1)",4.02679987293611
3205,3206,91357,The Devil's Arithmetic,4.026795296709012
3452,3453,12425532,"Of Poseidon (The Syrena Legacy, #1)",4.026599738660256
2918,2919,3047850,"Wicked (Pretty Little Liars, #5)",4.026583105356739
2643,2644,5167,Cane River,4.02648151804592
2890,2891,6545536,"The Emperor's Code (The 39 Clues, #8)",4.026022031167265
2969,2970,128759,"Fatal Voyage (Temperance Brennan, #4)",4.025998051666944
2665,2666,19675,"Executive Orders (Jack Ryan Universe, #9)",4.025885133725085
3564,3565,17461,"Misty of Chincoteague (Misty, #1)",4.025801952561839
4636,4637,16117804,"The Proposal (The Proposition, #2)",4.02554224078844
2809,2810,16286,The Magus,4.025206663655111
4806,4807,16119079,"Forever My Girl (The Beaumont Series, #1)",4.025189955294074
2916,2917,72223,The Worst Hard Time: The Untold Story of Those Who Survived the Great American Dust Bowl,4.025029743320763
4423,4424,6696602,"Infinity (Chronicles of Nick, #1)",4.02483762594899
3058,3059,40745,Mindset: The New Psychology of Success,4.024714772747686
4142,4143,18298225,On the Fence,4.024644346758944
2842,2843,3918010,"Kick-Ass (Kick-Ass, #1)",4.024571483416437
3434,3435,17349203,"Fortunately, the Milk",4.024515331387752
4575,4576,30253864,"Talking as Fast as I Can: From Gilmore Girls to Gilmore Girls, and Everything in Between",4.024506633230995
3879,3880,17876897,"One with You (Crossfire, #5)",4.024229570490641
2129,2130,11966216,"Torn (Trylle, #2)",4.024226460535008
4579,4580,283494,"Ironside (Modern Faerie Tales, #3)",4.024183417547433
6070,6071,15843166,You Are a Badass: How to Stop Doubting Your Greatness and Start Living an Awesome Life,4.023841534105027
5177,5178,22611920,"The Hook Up (Game On, #1)",4.023699609755353
3848,3849,10138607,Habibi,4.023618823033679
3484,3485,51299,Letter to a Christian Nation,4.022881546489605
5048,5049,28553,"Dragondrums (Harper Hall, #3)",4.022845935436482
4024,4025,84777,"City of Bones (Harry Bosch, #8; Harry Bosch Universe, #10)",4.022706111163963
5969,5970,7743783,"The Unidentified Redhead (Redhead, #1)",4.02261703811842
7162,7163,17977710,"Twisted (Tangled, #2)",4.022603427699903
7223,7224,16174197,"Knight & Play (Knight, #1)",4.022402105505748
4564,4565,34534,"The Amazing Maurice and His Educated Rodents (Discworld, #28)",4.022395133664946
3552,3553,20454672,Mean Streak,4.022381949549015
4265,4266,234501,"Startide Rising (The Uplift Saga, #2)",4.022356300400357
4553,4554,133765,"Those Left Behind (Serenity, #1)",4.021975001983076
3718,3719,53447,El túnel,4.021951004716077
3958,3959,3134981,The Joker,4.021898722529618
3287,3288,20316309,في قلبي أنثى عبرية,4.0218490202643675
4912,4913,233044,"The Shop on Blossom Street (Blossom Street, #1)",4.0218279895152955
2831,2832,20706317,The First Fifteen Lives of Harry August,4.021604822641293
4532,4533,377425,Flight of the Intruder (Jake Grafton #1),4.021363956629116
1797,1798,11389875,"Edge of Eternity (The Century Trilogy, #3)",4.021230137640944
5107,5108,82751,Chinese Cinderella: The True Story of an Unwanted Daughter,4.0212085303943335
19,20,7260188,"Mockingjay (The Hunger Games, #3)",4.029662066711739
85,86,32542,A Time to Kill,4.029049467913603
29,30,8442457,Gone Girl,4.028897526847698
123,124,7937843,Room,4.02889521844998
184,185,9361589,The Night Circus,4.028694663284879
206,207,6853,"One for the Money (Stephanie Plum, #1)",4.0285726180826735
256,257,13023,Alice in Wonderland,4.028385562043866
281,282,17061,Coraline,4.02825702765347
446,447,2248573,"Brisingr (The Inheritance Cycle, #3)",4.027472886443543
358,359,16115612,And the Mountains Echoed,4.027331688601992
562,563,140082,"Club Dead (Sookie Stackhouse, #3)",4.027094440646786
536,537,12609433,The Power of Habit: Why We Do What We Do in Life and Business,4.026678682345137
614,615,22205,This Lullaby,4.026599040379341
833,834,4502877,"Midnight Sun (Twilight, #1.5)",4.026306270035505
879,880,2800905,"The Summoning (Darkest Powers, #1)",4.026165853868438
694,695,18214414,"The Silkworm (Cormoran Strike, #2)",4.025832397896766
856,857,902,The Westing Game,4.0257449847609825
1057,1058,16331,"Murder at the Vicarage (Miss Marple, #1)",4.024889498217055
1020,1021,25460,"Animal, Vegetable, Miracle: A Year of Food Life",4.024398963222309
1558,1559,12716010,"Rapture (Fallen, #4)",4.024147039018858
1395,1396,259836,"Dragons of Autumn Twilight  (Dragonlance: Chronicles, #1)",4.023958240612275
1464,1465,187181,The Chosen,4.023595300283595
1723,1724,7402393,Nightshade (Nightshade #1; Nightshade World #4),4.023512884076989
1661,1662,6693,Fantastic Mr. Fox,4.023251004646068
1302,1303,347852,"The Road Less Traveled: A New Psychology of Love, Traditional Values, and Spiritual Growth",4.022859712240651
1575,1576,7912007,"Full Dark, No Stars",4.022810322941554
1560,1561,130440,Doctor Zhivago,4.0227483769637065
